body,subreddit
"So lads I was wondering why doesn't Telegram bring chat heads function. Facebook Messenger has it and it's very handy . While chatting , it's very painful to go to the app every time just to send a message. Android 11 has bubble feature , but what about us ? We want Chat Heads :(",Telegram
"Same issue here, can?t access on my iphone xs max, ipad and my laptop. Surprisingly, i can access just one group chat and send stuff there. And this has been persisting close to 24hr. I definitely need a fix for this soon!",Telegram
"I had the same issue, and it seems the only way I found to fix it is to open the Settings, scroll all the way down to the ""Default Interface Scale"" section and change it to a higher setting. By default for me, it was originally at 150% and all of the conversation bubbles were aligned on the left side of the screen.

When I changed it to 200%, then it showed my messages on the right and the other person's messages on the left, just as it does in the mobile app.

I have no idea why this setting should change the chat bubble alignment, but it does.

[https://i.imgur.com/sFmmzVh.png](https://i.imgur.com/sFmmzVh.png)",Telegram
"Channels aren't the same thing as groups, which is probably what you want.

Channels are one-way communication, like someone's blog or a news feed or whatever. Other people can only comment in those if the channel owner enables that feature. Groups are, well, group chats, where all people in it can reply and you can see the members list.",Telegram
"I noticed this too, I had a few bots that were for books and research papers and they are gone. They were fully legal, they just indexed known public sources. I think this was about the last update? I noticed late probably, but maybe that's the timeframe.",Telegram
"Hello

My phone can take 2 SIM cards and I have a private phone number that no one knows about.

If I join Telegram on that number, would my contacts get a notification even though they don't have  that number saved?",Telegram
I can't seem to find (on my phone) where the heck you can unban someone. Any ideas? When I googled it all of the answers seem to be for older versions of telegram because the menus do not have the information that was suggested.,Telegram
"In the Telegram app, you can see what members joined from which specific invite link. I would like to access that information through Telegram API. However, I could not find it on their docs. The [ChatInviteLink](https://core.telegram.org/bots/api#chatinvitelink) section does not have a field for that type of information.

&#x200B;

&#x200B;

https://preview.redd.it/1hc1n8jkxcp71.png?width=453&format=png&auto=webp&s=8235b1bba652beb642d0cccd82809c86b5f7d182",Telegram
"The ""group migrated"" thing is definitely a sign of it being converted to supergroup. You might have converted it unknowingly, by changing user permissions or some other settings.

The other thing sounds like a bug, though. How old are the messages you've got pinned and what version of the app are you using?",Telegram
"I would seriously doubt that employers would track you on Telegram since it's not that popular in our neck of the woods yet. However, just to clarify: even if they found your account, there's no way for them to know what groups you're in and who you're chatting to.

Should they find your account, they'd just know your username, see your profile pic and see your bio - if you have set any of those things. But to even find your account they'd either need to know your username or phone number. **But** you can restrict your account from being found via phone number if you have a username set. So your employer puts your phone into Search and finds nothing.

For security, you can use Secret Chats to make sure only you and the person you're talking to can ever access the data and only from your current devices. I also highly recommend enabling two-factor authentication. Not because of employers, just cause it's a good idea for any account on any platform.",Telegram
"Hi, recently (past few days) I have been noticing that I am unable to send and receive voice notes reliably. They spend forever uploading/downloading and my contacts also tell me they are having difficulty sending/receiving voice notes in our chats. I have tried using both data and wifi but it doesn't make a difference and my device has gigabytes of storage left. It doesn't load reliably on my telegram desktop app either. Is this a problem with telegram's servers and are other people also experiencing the same issues?",Telegram
"Hello,

I want to share my new application with you. As the title says it lets you to convert your stickers between Telegram and WhatsApp.

Whether you are using both and want to get your favorite stickers from Telegram to WhatsApp, or you've found a good WhatsApp stickers pack that you want to get on Telegram (as static stickers due to technical limitations). This application is the best choice for you.

The application includes the great list of trending Telegram stickers, but with more features like filtering it by name or randomly sorting it each time you open the pick dialog. You also can share pack link to it if you want.

You can download it from Play Store

[StickerConv - Convert to/from WhatsApp & Telegram - Apps on Google Play](https://play.google.com/store/apps/details?id=com.mayakapps.stickerconv)

Screenshots

[https://imgur.com/a/9JozSWN](https://imgur.com/a/9JozSWN)

Waiting for your feedback",Telegram
"&#x200B;

to fix it, go to camera app, and when camera app opens, if selfie cam is shown, change to back cam

&#x200B;

so when you open camera app, back cam opens, make ur back cam focus on sth

&#x200B;

then if go back to telegram, it should be fine",Telegram
"So basically I want to cut off ties from this person and disappear. He's really clingy and just won't leave me alone even after repeated signals. So all in all, I'll be deleting my current Telegram account, I've blocked his phone number and blocked him on WhatsApp, but how do I ensure that he does not find out when I make a new account on Telegram? Or is there no way to prevent him from knowing (since he has my number)?",Telegram
"Bots and scammers(not the bot you can chat with... User account managed by bots) contacted me a lot of times

They have no username and no mobile number in their account details but they can still contact me. Telegram says that this is normal!",Telegram
"Does your saved contacts have country code in them?

Telegram check for contact if it includes ""+"" ""Country Code"" and ""Number""
After making changes with contacts, go to Telegram Settings > Privacy and security > Contacts
Turn off sync contact, Delete sync contacts. Then turn on sync contacts again

Or
Telegram Settings > scroll to bottom, tap and hold on version number twice {Telegram for Android version number} 
There is an option to reload / import contacts",Telegram
"The concept is fun and interesting but has absolutely no link with telegram. Telegram has no way to parse a video feed in real time, and feed it to like a bot. At best one coule develop a bot to do that with pictures or videos. But it'd need a solid backend.",Telegram
"On iOS if you elect to not show the senders name when forwarding it no longer mentions that it?s a forwarded message at all.
I think it should still show its forwarded but just not from who. Otherwise it?s just copy and paste?
Hopefully this is an oversight that will be fixed.",Telegram
"I *really* tried to understand it. But this still feels like a kind of invasion into others' space, and it feels like this more and more to me. It is as absurd as deleting others' messages from a group chat.

I do understand deleting sent messages from both histories, and received messages from own history - that's our own data. But ability to delete others' messages from their devices seems like crossing a line and deleting others' data - this does feel a lot like censoring others. I would understand it if permission for such action would be given to the other, but otherwise I just can not see the justification.

Anyone knows how does Telegram explain this, or have they even addressed this anywhere?? What's your own best realistic guess on the reasons for existence of this feature??",Telegram
"Is there a telegram API available to read channel messages in real-time?  


I'm basically interested in reading the messages and take an action outside of telegram.

Any link to existing project or documentation would be helpful",Telegram
"Answer for ""What's a supergroup?"" is as u/Anchorsense said.  
Also know what converts a normal group into a super group:   
\*making the group public  
\*changing a user's permissions  
\*changing an admin's permissions  
\*changing group history visibility  
\*the 201st member joins",Telegram
"use case: my uncle went to a football game a few months ago and sent me about forty photos of the event that same weekend. I want to save now save them to my gallery and have them show up at the date he sent them to me, no todays date. Am I missing a super simple setting?

&#x200B;

 Is it a bug? I?ve tried it on iOS and iPadOS but behaviour is the same on both of them. is there a way to do it on Mac or Windows?",Telegram
"So i can copy the post link of a certain message in telegram but when my friend trie to open it all it says is ""Safari cannot open the page because the server cannot be found"". Tried on their laptop and android phone but same thing. 

When i use the link, it works. It opens in the app to the specific message. Any ideas what's the fix for this?",Telegram
"Hi.

I have a voice file in a chat of Telegram and I would like to export it.

I know that recording the screen and the internal audio I can ""save"" it.
However, I would like just to save the audio file and not a video.

Is there any app that allow me to record the internal audio only, without being forced to record also the screen?

Thank you in advance",Telegram
"Doesn't Telegram store all of this data in the cloud so it wouldn't be on your device anyway? 

I presume it would store the data for Secret Chats on your device for obvious reasons.

Have you tried a file manager app to see where all this data is being stored? Havee you tried reinstalling the app?",Telegram
I think it's rebuilding your local database. Probably depends a lot on how much is stored on your phone + your phone models storage speed. Guess it's possible to take quite long. At worst just delete the app and reinstall,Telegram
"""...After updating Telegram, some users may have to wait a minute or two for their chat database to be optimized for 64 bits. We are also investigating a few reports from the Android users that are facing connection issues after updating the app. We are fixing this, but if you don't want to wait, logging out and in again will help.""

That's what Durov said.",Telegram
"They are just links like any other messenger /social media. Open links only if you trust the person who send you. Links could be scams, ads, hacker getting to know you or a simple article.

Also note, hyperlink is available on Telegram. Verify the link in browser.",Telegram
"Hi, All. 

I'm in a Telegram group that I enjoy interacting with. However, there's a certain user who is always making asinine comments whenever I post. I'm smart enough to just ignore whenever he responds to my messages. However, is there anyway to simply put him on my ""blocked users"" list or an ""ignore users list?"" 

This user isn't a contact of mine. They're just a member of a group I'm apart of. It's so frustrating. I'd be infinitely happier if I could just ignore anything he posts and just enjoy interacting with the other members of the group. 

Thank you in advance.",Telegram
"When I select specific media and click on the trash bin icon it just says *?If you want to save space on your device, you don?t have to delete anything.?* This notification only leads to the cache settings for each chat. But I dont want to delete the cache for the whole chat, just one specific video. And also not for everyone, just for me.

Why isn't this possible?",Telegram
"I signed in my number which I've used also back then which I am still using.

Why did everything dissappear? It was like I had to make a new account again even though I got a lot of stuff back then, it was all starting from scratch. Is it possible to recover my saved messages/bots back then?

edit: I looked through the settings and it seems Telegram has a self destruct feature if left unattended for 6 months default... this sucks",Telegram
"On Android (and probably iOS too) you can long press the picture of the chat to open a preview (which won't mark it as read)

As for replies, simple text based replies can be made right from the notification shade ever since Android 7 (which won't mark the message as read afaik), similar thing on iOS too I believe",Telegram
"Today I received this message:

>Hello  
Your username is spread on \*\*\*\* channels. Change your username to prevent it  
\\@\_\_\_\_\_\_  
>  
>Take this warning seriously

I'm not sure what to do now, I'm worried to be flooded in some way, and I read that moving to a channel is risky since could happen that the transfer protection doesn't work.

Has anyone had a similar experience?",Telegram
"I'm using Macbook, I would like to find a way to be able to copy paste a message on Telegram without having to highlight it with my mouse and use command + c to copy it.

Is there any way? I've been looking for shortcuts in my settings preferences, but nothing seems to help.",Telegram
"there is no such option

you could forward all the voice notes you want to listen to in succession in the right order (with multi select) and then listen to them there. you won't be interrupted by anything that you haven't forwarded there.",Telegram
"Hey everyone, looking for some information/advice. A few bots I interacted with on telegram have recently all been deleted without warning. None of the bots were doing anything particularly illegal/dangerous, so I?m not sure why it?s happened. Clones of these accounts still exist (that have all the exact same information as the legitimate ones), but the actual accounts and the televend account have all disappeared. 

Has anyone had this happen in the past? I?ve only used telegram for the last year or so and don?t use it even every week, so I?m green about it. Any advice is welcome, I?m trying to figure out what?s happened and what the likelihood is of the accounts being able to come back. Thanks in advance.",Telegram
"there is a solution to this, first, enlarge your window, because due to a bug this option does not appear on low widths.

https://i.imgur.com/h6a88Wl.png

you want to change this option ""adaptive layout for wide screens""",Telegram
"(The actual reply I'm talking about:)

This is going to seem entirely out of left field, but for those looking for that OG function of Drafts... as just a safe place to compose text you intend to use elsewhere (as opposed to the Tweet compose interface, which just lost me like 15 minutes of typing, which led me here... hehe,) 

I have been using [**Telegram**](https://desktop.telegram.org/), of all things for years. notably, if you hit Ctrl + 0 from *anywhere* in the Windows client, you and your cursor are taken to the compose field beneath your personal ""Saved Messages"" channel, which is searchable, has an extremely high per-message character limit (after which it just automatically splits,) and is ridiculously reliable in saving ""drafts"" live as you're typing. as in... I have actively tried to lose characters by killing the application and then logging in on my phone and have yet to accomplish losing a single one (among other advantages: zero formatting added to plain text by default - not even line breaks - no total file limit and *2GB* per file limit uploads, absurdly cross-platform, literally more reliable than SMS in poor network conditions.) you can immediately reenter a sent message with `?` to edit, copy it, escape with just `Esc` and then paste to start a new revision.",Telegram
"How has ""taking a long time to reply"" evolved into ""ghosting""? The only message they didn't reply to was the last one and OP chose to publish his findings instead of waiting for a reply.

> Interestingly, in 2019, a separate bug also relating to the self-destruct feature was reported by another researcher who walked away with a higher bug bounty?a ?2,500 ($2,897) reward rather than a measly ?1,000.

Bugs have different levels of severity and finding a small repeat flaw is likely not judged as valuable.

> ""I have not received the promised reward from Telegram in ?1,000 or any other,"" he wrote.

Yeah, he didn't sign the NDA, what the hell did he expect?",Telegram
"I'm not sure, aren't channels working this way? You have someone posting a message, and then on each message your have a thread people can respond to ([Durov's Channel](https://t.me/durov) is the one I have in mind, I don't know if they're all configured this way).",Telegram
"Are you looking for a specific channel?  
If it's public,  
just search its id in search bar. Or type it somewhere (e.g. `@TelegramTips`) then hit the ""join channel"".  
And for private channels, you need an invite link. Or ask an admin you know to add you.",Telegram
"i had a similar problem with a bot due to copyright.... as another ppl already mentioned download it right from the site and not play store, for me it worked (or u can use the web telegram too it also works tho)",Telegram
"Don't mind me, I'm just here early to see a civil war erupt between two camps: those who like the new group read receipts and those who don't.

PS: The live stream recordings are a nice feature. The interactive poop emoji is... unexpected.",Telegram
" 

Hi guys I have twice posted this previously but not one  comment yet?

Does anyone have any advice as to how to solve this annoying little glitch?

Profile Picture not showing

Hi does anyone know why my chosen Profile picture.jpg is not showing on my posts in Telegram app on iPad 7.8.2 and desktop app 2.8.4x64 (just updated from this version) as well?

I have the chosen .jpg and or the .png visible on my profile when I look in settings and I have it set to show to ""Everybody"" but it does not show on either platform when I post?

And I see no option to use just letters as some choose to do???

What might I be doing wrong??",Telegram
"Hey there,

&#x200B;

So I have accidentally deleted a chat on telegram  with a girl  . She gave me her ""@-name"" on telegram but I have forgotten it.. Is there any way to find out the ""@-name"" of the girl ??

Does telegram stores these data somewhere?",Telegram
I'm 90% certain that they're gonna do something big with video calls this month but I'd highly doubt it's coming on the 14th. Maybe they'll release the quizzes thing on the 14th and then a huge expansion to video calls when the 8.0 hits?,Telegram
"Hi there. I deleted telegram for ipad (if I'm not mistaken 7.3.6 version) and since reinstall it to my old ipad mini with newer version. Problem is I can't open the app,it only shows white screen before reverting to my ipad home screen. i tried using telegram web (both Z and K version) and they only show white screen? Does anyone know what to do?",Telegram
"I have my number hidden and I don?t have a username on my account. I only ask for person?s username so I can message them.

I?ve then deleted our conversation (both ends). My question is, what if they?ve added me as a contact? Will they be able to message me still? Will they be able to see my profile picture?",Telegram
I'm in a group chat which is very informative except there's people who just love to react to everything with GIFs stickers etc. It's really annoying but I don't see a way to block those from appearing in the chat. Unless someone here knows the way.,Telegram
"I think it's depends a bit on the context, if you want to read all past messages in a channel you need to build a telegram client, you can look up telethon (python) or tlsharp (c#). If you only need to read new messages you have to create a bot and add it to the channel, there are a ton of libraries you can use.
Lots of examples here: https://core.telegram.org/bots/samples",Telegram
"Well, maybe he just installed Telegram, some of their friends used his number to do it and took the SMS code from their phone. Multiple options actually, but it just means that the number has been used to create a Telegram account.",Telegram
"FWIW I tried Telegram app on macOS version 8.1 and I had the same problem. Seems like this latest update, or the one before that, broke something. I can navigate within the app, but clicking on any of the chats I follow nothing happens. It's as if  the app UI has lost its ability to detect the cursor hovering over those items, hence the mouse click registers no action. Whatever the problem is, I hope they sort it out. Maybe it has something to do with me still using macOS 10.14.6 Mojave.

Meanwhile, I dropped back to version 7.9 and the problem is gone. I use TimeMachine, so it was an easy workaround.",Telegram
"Hi,


Right now, my php app has the ability to send email reminders to users via ```phpmailer```. So i am looking for a telegram equivalent. The users cell / mobile phone number is stored in my app.


How do you guys do this ?  I have seen this tutorial in youtube ( https://www.youtube.com/watch?v=UhZtrhV7t3U ) and other similar ones   but its more about sending messages to a telegram group.


Thanks.",Telegram
"Anyone else experiencing this and how do I disable it?  
  
When I send stuff to my friends or clear my phone gallery sometimes I find 2 second videos (often depicting a reaction meme like suprise or anger).  
  
I don't remember enabling any of these settings. Wondering if it's due to a new phone (my old phone doesn't have such issues).",Telegram
"You?re using an Android preview version, didn?t you know the ?risks? of using such a versions? 
There are lot of changes on the os that apps will have to adapt to or fix issues with. Telegram devs have just started fixing issues with Android 12, as it was not a priority because Android 12 is not official yet???????. 
So it?s just a matter of time so that the issues you?re facing, are fixed.",Telegram
"Hello everyone, I have been having a problem with Telegram on my iPhone XR (iOS 14.7.1). My Telegram is set to have a maximum of 5GB of cache file and delete it every three days, I set it in the app settings. The problem is, my iPhone says that now Telegram occupies 20GB of space on my phone and this is particularly annoying since my iPhone only has 64GB of space. 

&#x200B;

https://preview.redd.it/3nnkshr973j71.jpg?width=591&format=pjpg&auto=webp&s=3cf6b882c7616ef21763887e91c86b1345630d55

&#x200B;

Can anyone tell me how to solve it? I follow a lot of Telegram channels and I already unfollowed a lot of them but I would want to be able to still follow them and not occupy almost half of space on my iPhone. Thanks in advance for your help!",Telegram
You can long press on the chat to create a small popup such that you can read the message but it won't be marked as read. On Android this works if you tap on the profile photo circle. iOS it's anywhere on the chat bar.,Telegram
"So my SIM provider allows certain apps to be able to connect and not use your data allowance, apologies if this isn't allowed. But I'm curious is there a way that I can make it look like I'm connecting to Whatsapp as Telegram isn't supported. Or even to a website. 

I don't mind it using my data so it's not the end of the world. But I'm just curious is the possible?",Telegram
"Still waiting for:

-	restore search from outside the app (removed in telegram X)
-	better share sheet (media editor, caption)
-	ending notifications when contact joins (they still appear in chat)
-	iOS shortcuts actually working
-	more short name slots (I?ll pay)

??",Telegram
"Looking at Telegram's official Wikipedia page, it's helpful if you want to know about the company's history and all that stuff but there's very little detail about features. Considering how many the app has, I feel like a community-made resource to learn about Telegram's features would be nice. So I found a Telegram Wiki someone made on Fandom and have been adding to it bit by bit. But I only know so much so having some help would be great. If anyone is interested, let's try to add some knowledge to it: https://telegram.fandom.com/wiki/Telegram_Wiki I've made like 30 pages with some of the features that I regularly use and know something about but feel free to add info to them or make new pages.

Also, maybe once it actually has enough info, our mods can put it on the sidebar to help newbies and reduce the number of posts about basic issues.",Telegram
"Telegram X is back btw and the option is there (at least in the direct version in the tgx\_log channel, don't know about the play store version), you could maybe also try the direct version of regular Telegram which should have fewer restrictions (in comparison to the playstore version) [https://telegram.org/android](https://telegram.org/android)  


btw, appreciate your honesty ????",Telegram
Telegram is  security nightmare. Use Signal or Threema if you want security and privacy. Or use Secret Chats in Telegram if you don't need group chats (you contacts and metadata will still be sent to their servers),Telegram
"I tried inviting my friend to Telegram and the message never delivered. I tried using the app invite, and when that failed, just a link to the site. Both were blocked. Regular links work just fine. I just tested it again, next to him, and Telegram links just won't go through. 

He has Verizon and a Galaxy 21. Is it possible Verizon is blocking links to Telegram?",Telegram
