body,subreddit
"follow accounts like this one: https://instagram.com/sferro21

he's hot af and teaches boys how to pose and take pics. there are loads of tutorials on his page. here is an example: https://www.instagram.com/reel/CIn1lTXlMku/",Instagram
"It?s been on my mind for a long time and is my most frustrating part of using the app because if a comment on a major page is really popular, it can have thousands of likes and replies so to me, I?m much more interested in what people were saying right after that comment was posted since that?s where the conversations start rather than seeing what someone replies a few seconds ago. Even if it?s 100 replies, it takes such a long time to scroll through them at the default pace IG sets (seems like 5 ish per ?view more?) so I usually give up after 4 or 5 scrolls. No other major platform uses this system (Facebook, TikTok) and it?s my number one dislike about Instagram as a whole. Does anyone else feel the same? Or does someone disagree? Would love to hear both sides!",Instagram
"You actually made me spit-take. You're getting banned for THAT?! That's a G-rated insult at least.

Also, Instagram's laws are like the laws of North Korea. Everything and yet nothing is off the table.",Instagram
"I occasionally post some pretty pictures I took. Old or new. I follow you back if I like your feed (my standards aren't very high).

https://www.instagram.com/cleefrex/

Also follow my other page for pretty pictures of donkeys me and my friends take.

https://www.instagram.com/eselgram/",Instagram
"I?m trying to ask for music but I can?t, I look it up and it tells me it?s in the right of the text icon but when I pull it up I get the option to change the colors, I?m on iPhone and I?m on the latest version of insta",Instagram
"I think I found a fix. I had to re-download IG on my phone today and it's gone like many people have had happen to them but I found a workaround.

Go into any reel through explore or your feed or your own old reels, then top right will have a camera icon and click that.

You should be able to still make reels that way. 

Hope this helps anyone.",Instagram
"Why is Instagram such a shitter app dawg, I hate how they try and over complicate everything 24/7. All I want to do is send a post to my story, and the option isn?t available for any posts from any accounts whatsoever. I have done everything that was said to do on google in my settings, and it is still unavailable. I?m sorry to be annoyed, but it?s been a minute since I?ve ever even considered posting and its not available, so if anyone could help it would be greatly appreciated ??",Instagram
"I've recently been using an app store app to get more followers on Instagram, but 1 day after using it Instagram is now asking me to confirm my identity. They're sending a link to an old email address that I have (not the email that's registered with the account) for some reason? 

The issue is that I no longer have access to this old email address, is there any way for me to get around this or is my account gone?",Instagram
"My account was randomly disabled three months ago. I have submitted appeals nearly everyday (took a week or two off) and have received several responses. I first received a response saying Due to COVID-19 we do not have enough employees to review your case right now. Then I received the email with the code and request for verification. I have responded to the code email around 20 times. I?ve received a few emails saying my photo isn?t clear enough which is insane, it?s so fucking clear. Not sure what else I can do. I had that account since I was a kid and since it was connected to my Facebook, Facebook is gone too.",Instagram
"It's like you get a notification that someone wants to follow you, just for you to accept it and then have to request to follow them because they're account is private... why? It just makes logical sense that you'd also be following them. Why would someone accept a follow request if that person is just not going to accept your request? And tbh that's one sided and not smart at all.

Someone with negative intentions could just send a follow request, you accept it, then they could get any information they want to get from your profile, whole time they have all the access to everything on your profile but you're still on pending, not being able to see anything from their account.

It's more of a privacy concern and a design flaw than anything. You should automatically be following each other (or at the very least able to see their profile info even on private) if someone accepts a follow.",Instagram
I know the simple solution is to login but I'd rather keep the amount of devices I'm logged into at a minimum. Also I'd rather not have to log in everytime I want to see a tattoo artist instagram or something like that. Is there a way to fix that?,Instagram
"I've been getting the same notification every day on my lock screen from random accounts I don't care about but have looked through the notifications settings in Instagram but cannot find the setting that turns off this option??

Anyone else had this? Please help, its driving me crazy",Instagram
Posted 2 reels since the outage and my number of views have been significantly lower than my previous reels.  Like 65-80% down in number of views. Dont get it. Not sure if I si.oly shouldn't post things atm. Even a feed post had significantly lesserer likes than on average before the outage. Sigh :/,Instagram
"I am asking it here in anticipation to get a helpful answer. I usually use instagram on site and one day a message popped up saying "" Confirm your info on app to get back to your account"".

I tried logging in by app , and the app doesn't let me stay logged in for more than few seconds , and then the screen goes all white. I have tried everything till now, changing passwords , choosing securing account, logging by different device aur clearing cache. The error message also says ' We noticed unusual activity from your account. Confirm your identity from the Instagram app to get back to your account.' And all i do with my account is just save recipes i like, i don't even use it much.

Can someone help me with this, I'd be grateful.",Instagram
"I tried using only 5 hashtags on two posts after reading about this, so this wasn't an extensive test by any means, but yeah my reach was way down as well. 

People are speculating that the reason why the creator account is recommending only 3-5 hashtags is because people are using irrelevant hashtags when trying to use more (especially all 30) and it's ""confusing"" the algorithm. There are so many hashtags that are effectively useless in terms of searching for specific content because people will use them for literally anything. The theory is if you use fewer hashtags, it makes it easier for the algorithm to categorize your post into a specific niche and get it in front of the right people.",Instagram
"Personal account. I post selfies, memes, life updates, etc. I?m a 35 year old woman living in the Midwest. I?m an atheist, leftist, going through a divorce/separation, have two kids, a long distance boyfriend, a psychology degree, working on an MSW. I?m also a photographer. I have autism and adhd. 

If any of that sounds at all interesting: https://www.instagram.com/celestial.punch/

Let me know you?re from Reddit and I?ll follow back!",Instagram
I have some sketches I'd like to post on Instagram and link people to my patreon to see the full image. If I crop the art to avoid showing below the chest (no boobies will be shown) will that be good even though they're both shirtless?,Instagram
"Here's the thing, when i upload a fucking story it goes all as usual until it expires and i put it in highlight. After a day or two when i try to view it, it just keeps loading forever. I trid it from A LOT of different devices and accounts and it JUST FUCKING WON'T LOAD AND IT'S SO FRUSTRATING THAT IT APPEARS THAT ONLY I HAVE THIS BUG. I send instagram support a report explaining the problem but i feel like i would have better chances sending it to Saint Fucking Nicolas.. Anyone with this bug also? Anyone with suggestions on what to do?",Instagram
"I'm on Instagram \[@phototastic.ks\]([https://www.instagram.com/phototastic.ks/](https://www.instagram.com/phototastic.ks/))
  

  
I just got a new camera, I'm Honda civic coupe owner and a car guy. Lemme know if you come from Reddit for f4f and l4l",Instagram
"Background info: I have two IG accounts within the same niche, but both accounts have different content. There is some crossover between them but I use them both for different things. I used both my accounts for a reels experiment to see if I could make some sort of sense out of them. 

1) the same reel posted on both accounts might do really well on one account, and extremely poor on the other. For example, one reel had 30k views on one account, and 17 total on the other. Both were posted at the same time with similar hashtags and different captions - what would cause such a dramatic difference in exposure?

2) follower count seems to have no effect on reel views. The account with more followers will often do worse in terms of views, but that?s not always the case. 

3) reels with a lot of engagement from my followers will frequently not be shown to non-followers. I feel like that?s the opposite of what should happen. 

4) videos that go viral on other platforms barely get views on reels 

5) the past week in general has been shit for reel views. I assumed it had to do with IG being shut down for a day but neither of my accounts have recovered. 

Does anyone have any thoughts on these? Any advice? Anyone noticed the same things?",Instagram
"Recently in the past couple months I?ve been having problems with gaining followers without gaining followers. Well basically when I open Instagram I have a small notification that I?ve got a new follower. But when I press on the notification and open the ?activity? feed it says that I?ve gained no followers. But when I click on my profile I can see that my follower count has gone up. So then I press on ?followers? but there?s no new followers meaning I can?t remove the follower. Is this a common bug, is it a bug and if so how do I fix it? Thanks!",Instagram
I just close insta in just 4-5 minutes after opening. Especially after they started showing unnecessary content on my feed. It's just a load of spam now. I am not even watching stories that much these days..,Instagram
You can still cling to the 'eyeballs on my content' part without scrolling endlessly. It's not Instagram's fault tiktok became successful and IG needed to keep up. No one cares about creators. You're the medium for IG to make money. Stop deluding yourself with grand notions of 'XYZ was made just for me' it's all made for money,Instagram
For the past two weeks Ive been receiving a shadowban every time I tag friends (with their permission) on photos. After two days IG allows me to tag again and right after I get another ban. Why does this keep happening? It?s only a tag of one or two other people and never a bunch like I?ve seen others do?.,Instagram
">How do I stop these types of accounts appearing?

Not much can be done - FB has not done any proper account verification before you can message people and this is the result.

&#x200B;

You cant win with a script that can create countless accounts per minute.

&#x200B;

One thing that might make your account less attractive to target is if you were not commenting/liking any posts.",Instagram
"You have to write the right words in appeal form. In the last section write ""My lawyer has read the TOS and claims I have not violated anything. Please reactivate @ username"". Got my account banned 20 times or so but it always gets unbanned when I do this.",Instagram
"I placed many support request and they claim that my 2FA is logged out and that I should be able to get back in. Nothing to this day. They didn?t resolve anything. 

What else can I do and who else can I contact for further help?",Instagram
"Whofedwalter is a premium meme page offering 
the funniest content.
Our goal is to make sure you stay continuously laughing throughout the week. Whether at work or on the go we got you plugged on the best the internet has to offer. We provide and accept Comedy, Meme, Savage post & Culture. Email or DM for submissions are welcome so feel free to send us a message.
Come check out our page and give us a follow for daily premium posts.

Instagram @whofedwalter 

Or the link below

https://www.instagram.com/whofedwalter/[Whofedwalter ](https://www.instagram.com/whofedwalter/)",Instagram
I'm having issues logging in saying they have error. Was sent a mail by them today asking to send a photo of myself holding a paper with their code along with username and my full name. Does anyone think replying to this mail would solve anything? There are some YouTube videos about people who got their account back after doing the following.,Instagram
"If there were a good alternative, would you go there (talking to everyone reading)? We are ALL annoyed/at our end with IG, but here's the thing- there ARE other alternatives. Granted, nothing popular. There are other photo sharing apps where you can make profiles and post photos, but the problem is that no one is there. People say, ""I want an alternative!"" What they mean is, ""I want an alternative that all my friends are already on!"" And this doesn't yet exist. We would all have to actively work to CREATE a place and push all of our friends to go. I've been discussing making an app with a friend of mine just to give people a place where they can post, be seen, not be harassed with ads, etc. But I'm like.. this already exists. We are going to drop 80k into an app just for it to fail, all the while people continue to say, ""Gosh if only there were an alternative!"" We MAKE the alternative! The thing is that we have to get enough people together to agree to only go to ONE place, to build that place up so that there are people there! So it's not a dead app! I know many, MANY creators who have been disabled in the last few months, and my friend and I are also dealing with disabled pages/the same crap from IG. We are tired of it. But again, there are HUNDREDS of photo sharing apps. No sense in us creating another 'failed instagram alternative.' It's hard. The missing link here is unity. We need to have a place, one place where people converge to all agree, we are going to THIS app, and everyone go there and just choke instagram out. Only use instagram to promote this new app. 

This is what we need to do. It would have to be some sort of fixed site. We cant just make a reddit post that will be hot for 2 days and then get pushed down the feed and lose steam. Would have to be something available for a myriad of people to see, that will not get pushed down a feed and forgotten.",Instagram
"viks.png https://www.instagram.com/viks.png/

hi all! just a uni chick in a fashion program trying out new fashion outfits/pics/etc just an overall experiment for my feed too!

i also post on /r/womensstreetwear now !!

tips/advice welcome! ??",Instagram
"Hi every! It would mean a lot to me if you follow me on https://instagram.com/sugar_crystals_chocolate_co?utm_medium=copy_link 
I started my own crystal shop so please come hang out and see if something catches your eye!",Instagram
"if i hide someone from my stories, then upload some and highlight them, then remove the hiding after the story disappears, can they see the highlighted stories that I have hidden from them in my profile?",Instagram
"I think Instagram will be completely dead soon, my account is smaller, only around 1300 followers, but I used to get 100+ likes on my posts, now I'm lucky if I get 30 likes, I even tried paying for advertising on there and I got 50 likes, so not even half of what I was getting last year. I only post art as well, so I don't know why they've shadowbanned me.",Instagram
">I feel like it?s completely random who gets on

It's not a singular place to be on or in. Everyone sees something different. There's no global Explore with identical contents that everyone sees.

>I see people on the explore page with 100 likes tops or with millions. I?ve seen people get on the explore page with either no hashtags or minimum, have a small following, and they are on it.

Because this is what Instagram has been trained to show you, by what you've told them you're interested in. You decided this through your activity on Instagram.

>However my posts usually get 1000 likes within a hour, my hashtags brings in like 1000 viewers and then my followers make up another thousand. Abs explore page views is like 50.

Cool. So Instagram showed your post to 50 people whose content preference match what you post. You seem annoyed by this.

>What can I do to make sure I get on every time?

That's not how it works. Nobody can be on one billion separate Explore pages for one billion Instagram users.

As the other user in this thread posted, Instagram clearly explains Explore *right on their own website*: https://about.instagram.com/blog/announcements/shedding-more-light-on-how-instagram-works",Instagram
"I know you don't want to hear this, but people's pics get stolen all the time. This kind of stuff is very low priority for IG. Also, when IG talks about ""impersonation"", they're talking about a lot more than using someone else's pic.",Instagram
"Made a new account where I post movie clips and stuff like that, was tryna grow it a bit so I was doing follow for follow a bit. Got blocked from that, ok no big deal. Waited a few hours and tried again, ok no big deal. Went to sleep and next day woke up and tried again, didn?t work ok no big deal. Went to class and when I got out I was logged out. Ok no big deal. Logged back in to a pop up saying you?ve been logged out, wait what? Kept trying and now my account doesn?t even show up anymore. ?User not found.? Didn?t even get any warning or reason for it. God this is so frustrating. Any ideas?",Instagram
"Since yesterday night I've been unable to log into both my Facebook and Instagram accounts. Later I was sent an email by Facebook asking me to send a picture of me holding a hand-written code on a piece of paper for verification process. It's been a day now. When I try to log into Facebook they show a message 'You disagreed with the decision, it usually takes just a day to review your information. Check back here.
I'm not a frequent user of Facebook but Instagram. Unable to log into both. Instagram gives me a message saying' sorry we couldn't completely your request, please try again in a moment '
I have no idea what I'm supposed to do, I have life long memories on my Instagram and Facebook.",Instagram
"When I'm on the homepage for Instagram on Google, there's a notification in messages. It's not REAL. When someone actually sends me a message, it shows up as two message notifications. I get rid of the message, go back to home, and the notification is still there. I'M SO CONFUSED. HELP.",Instagram
"This occured a couple years ago. One day I logged into Instagram and all my posts were removed, even my profile picture. I never gave a real effort to recover them, but lately I've been searching bc there's a lot of memories I had on there. Idc about the captions, but if there was someway to get the photos from them is they have them that would amazing.

There doesn't seem to be any direct call line to Instagram, and I don't see any way in their help section to report this: How, if at all, can I contact Instagram about this problem?
Can I get my posts restored?
Do you think my account could've been hacked? And if so should I make a brand new account?",Instagram
"I used to go ig twice a day. since they started blocking accounts I only go maybe once a week in the past two months. Forget twitch, Now that I know how much a fool I was to donate to some account holders. I can spend my money in other ways",Instagram
"[@jakob_matharu](https://www.instagram.com/jakob_matharu/)

Personal account, resurrecting my social media presence mainly posting pictures every few days of me travelling, skydiving or flying.

Follow back for reddit fam as usual and expect regular likes on your content :) I'm not part of the unfollow game, and I expect you not to be either..",Instagram
"My account's been down for around two weeks now and I'm growing tired of just not having it, I've tried all I can and submitted appeals but they won't reply to them and they won't give me a code to get back in.",Instagram
"have you tried uninstalling, restarting your phone and reinstalling the app? how about logging in through an internet browser versus the app itself? 

this has happened to me 2 or 3 times before, have no idea why but uninstalling and restarting my phone usually does the trick!",Instagram
"I have a non-square image (a portrait) that i don?t want to crop. Is there a way to choose the focal point of the image when it appears on the grid so his head isn?t cut off at the top when someone is scrolling my grid?

TIA!",Instagram
"Anyone else's feed consisting of only one account? I follow over 1500 accounts and the NFL is the only one I'm seeing along with sponsor ads every 2 posts. Counted 57 NFL posts in a row now and I even gave up and blocked them, now its just snoop dog lmaooo. There smt going on?,",Instagram
"I downloaded Instagram in KZ(Which is originally Instagram in russian language) but I've decided that I want my Instagram to be in English since I got used to talk in that language and I just got bored of Russian language in general. 

When I re-installed my Instagram again, I've put the language ""English"" there, before logging in to my account. And for the past week, and this week, it was changing language by itself or mixing Russian and English language (e.g. when was last message sent in russian when open the chat in English). 

Is this a bug or should I change my phone's language to English so it will adapt.",Instagram
"I just discovered this gem. 

Just got off chat with a lady who explained to me that she could proceed no further in helping me escalate my claim because my 'disabled instagram page was linked to facebook business account of which I had no role in."" Of course this confused the F out of me, and I'm like how on earth could MY Instagram be linked to a facebook business manager of which I have no access to? Here was her reply, verbatim. Hold on to your seats. I about fell out of mine. 

 ""I understand that you are not aware of this, however once you switch your account to professional after some time Instagram itself will create a business manager on auto for your Instagram. Hence why you are not aware about this, in most cases we will advice to connect the Instagram straight to an existing business manager of yours before Instagram creates its own which you will not have a role and also no access to it.""

... BEFORE INSTAGRAM CREATES ITS OWN WHICH YOU WILL NOT HAVE A ROLE IN AND ALSO NO ACCESS TO IT."" 

What the actual FFFFFFFFFF.

I have been on a cumulative 30 business chats in the last year trying to get help with the 2 disabled pages of mine. Received no help from the chats, but always got either the 'here's the appeal link,' or the few times someone actually 'escalated' the claim (you get a different reply with every person you talk to so you have to just keep trying), there was never, NEVER any help even with those few who actually seemed like they wanted to explain what was going on (like this lady did). Now I understand that most literally could NOT help me, nor did they take the time to help me understand that because my accounts were linked to the 'INSTAGRAM' business manager (of which I have no access to) and not MY OWN, they could not help me. So they just gave me the canned, ""Can't help, it's beyond our scope, here's the appeal link' instead of ever trying to explain to me, like this lady did.

BUT, if you do have an account set up with YOUR business manager, I do think you have a shot at actually being helped. Here is what she told me to do (and what you should do if you have an active instagram page so that if you get disabled you have a shot at getting your page back via chat). 

**FOR THOSE WHO WILL ASK IN THE COMMENTS- Set up a business page and run a 5-10 dollar ad for a few days, then your business support chat will enable. This is how you get access to the chat. I also assume this is the business manager you'll need to connect your instagram to.** 

Here's what she suggested I do once I get the page back (it won't work when the page is disabled, of course).

""Since you are not sure about the business manager that is connected to it:  1) You will need to convert your Instagram account to personal account again. This will ensure that the Instagram is disconnected from the business manager. 2) Once that is done, you can wait for few minutes then change the Instagram account back to business/professional account. 3) Immediately head",Instagram
"Started last night. Windows desktop. Cleared history, restarted the computer, switched to another browser, tried desktop app instead, nothing worked. On phone is fine. I admit I was rolling down for more load (children illustrations). Isn't that supposedly a good thing?",Instagram
