body,subreddit
"It really isn't my preferred way of expressing myself and it cheapens the experience of communication when I don't have a choice about these things. Honestly it's really frustrating. I use Viber to keep in touch with my family abroad but if I can't turn these things off from within the app I think I'm going to start looking for an alternative :(. Other apps, like WhatsApp, Telegramm, FB Messenger etc. don't do this.

I truly appreciate help if anyone knows how to do this.",viber
"Hello. If you still haven't found out any help, please contact official Viber support here: help.viber.com/contact. Remember, that this subreddit is unofficial, and was created for regular user's discussions. Thank you

*I am a bot, and this action was performed automatically. Please [contact the moderators of this subreddit](/message/compose/?to=/r/viber) if you have any questions or concerns.*",viber
"Hello. If you still haven't found out any help, please contact official Viber support here: help.viber.com/contact. Remember, that this subreddit is unofficial, and was created for regular user's discussions. Thank you

*I am a bot, and this action was performed automatically. Please [contact the moderators of this subreddit](/message/compose/?to=/r/viber) if you have any questions or concerns.*",viber
"Hello,

If one person had Viber installed on one phone and one sim card, one phone number. Later deleted viber/formatted the phone. 

Then another person took the same phone and intalled viber and uses his own name there.

If I send a message to the first person's viber, will the second person see my message?

Or to be shorter, do messages go to a viber account or to the phone number?

My friend was fired from her workplace, left her work phone and sim card for the new worker and accidentally sent some bad video to her old viber and now she is afraid that another person who created his own viber with her old phone number might've received the video. is that possible?",viber
"Did You know, Popular messaging app Viber and eSewa, a leading Digital Payment Service in Nepal have formed a partnership? With this, Viber is said to include features like WeChat. You can send money, receive money, and recharge from Viber. 

If you want to know more than read about ""[eSewa And Viber Partnership](https://www.nepalitelecom.com/2020/12/esewa-and-viber-partnership-payment.html)"". I personally got this information from here.

https://preview.redd.it/t0nwv020ld561.jpg?width=1000&format=pjpg&auto=webp&s=2ed0efe99705f31117c2e5b1557e4564741faaa4",viber
"Hello guys,  


I'm having an Error that I couldnt find a solution anywhere.  
I dont know how to call it, its just blank. To see something on the viber window I must open some black screen behind of it. Just like in the video attached.  
I've tried to reinstall it, change some settings on compatibility mode, still nothing..  
[https://www.viber.com/download/](https://www.viber.com/download/) \- ive downloaded setup here.

Any idea whats happening?  


Thanks

https://reddit.com/link/8vqmrt/video/iabcsium2p711/player",viber
"Hello. If you still haven't found out any help, please contact official Viber support here: help.viber.com/contact. Remember, that this subreddit is unofficial, and was created for regular user's discussions. Thank you

*I am a bot, and this action was performed automatically. Please [contact the moderators of this subreddit](/message/compose/?to=/r/viber) if you have any questions or concerns.*",viber
"Whenever I use viber on PC to converse with someone, they can hear themselves and music in the background. However, when I use programs such as discord, skype and so on the problem is not present. Any solutions? Thanks.",viber
"Hello everyone! Recently I become a moderator of this community, and so it's finally going to change from abandoned state. But at first I would like to hear your thoughts on this, what would you like to be added, what would you like to be removed, or changed about this community. Thanks!",viber
"The timer option when sending a photo/video is **missing** on my Viber app.

I am using an updated version of the app and my android OS is updated to the latest patch.

Can someone help me with this?

Thank you!",viber
"viber desktop, i dunno what happened the SEND paper plane icon to the right of the message box disappeared and is not replaced with a stupid mic icon. i don't need it, i want the SEND button back. how do i fix this?",viber
"Using the viber app will be a way for me to get in touch with about half of my extended family. Before using the platform, I'd like to know what the privacy risks are. If anyone has any tips for navigating the app while ensuring my privacy remains in tact, I'd very much appreciate the advice.",viber
"Ok, I don't mind ads in a free app like Viber, nor do I mind that they come from places near my location, however, I can't delete those ads that came to me in a standard Viber message format whatsoever.

The option to delete them is not present at all, instead I get things like ""subscribe"" and so forth in the options. Is there any way to delete these message and/or block those profiles too? ",viber
"Any ideas on what's going on here and how to fix it?(RAM update not an option -- it's a grandma's old PC, she won't get used to new one)

https://preview.redd.it/u146h0syftt41.jpg?width=297&format=pjpg&auto=webp&s=a6ec4480c6adcaac5ec8e5008548b40d5dd1bd23",viber
"Hello. If you still haven't found out any help, please contact official Viber support here: help.viber.com/contact. Remember, that this subreddit is unofficial, and was created for regular user's discussions. Thank you

*I am a bot, and this action was performed automatically. Please [contact the moderators of this subreddit](/message/compose/?to=/r/viber) if you have any questions or concerns.*",viber
"Hello. If you still haven't found out any help, please contact official Viber support here: help.viber.com/contact. Remember, that this subreddit is unofficial, and was created for regular user's discussions. Thank you

*I am a bot, and this action was performed automatically. Please [contact the moderators of this subreddit](/message/compose/?to=/r/viber) if you have any questions or concerns.*",viber
"One feature that has been springing up in various VOIP apps is low data calling mode. Whatsapp can decrease the data consumption from 310 KBpm to 204 KBpm by switching on this mode. A similar less-known app Zangi prides itself on 216 KBpm and 134 KBpm on low data mode.  Although viber is quoted at the low rate of 240 KBpm, I think it would be nice to have an even lower data rate option which would increasingly improve quality in poor cellular coverage, congested, high ping-time environments including driving in a car. Thoughts?

Edit. The following website and chart argues that Viber uses even more than WhatsApp. Viber what are you doing?
https://zangi.com/news/wp-content/uploads/2017/01/DiagramSmall.jpg
https://zangi.com/news/en/why-low-data-usage-is-important-for-your-messenger/",viber
"Hi everyone,

for the past 2 days I have been getting random calls from countries like The Netherlands, Ukraine and Afghanistan (?!). Is someone else experiencing this and if so, does anyone know how can you stop it?

Cheers!",viber
"Not natively, but you can probably get it done using [Tasker](https://play.google.com/store/apps/details?id=net.dinglisch.android.taskerm) with [AutoNotification](https://play.google.com/store/apps/details?id=com.joaomgcd.autonotification).",viber
"I mean, who even uses calls these days? well, a friend who's moved abroad, doesn't know anyone there, and keeps calling when she's bored. she can't talk for less than 2 hours, which is unacceptable when I'm focusing on something else. there needs to be a way to turn this nonsense feature off, it's there just to bother you",viber
"Hello. If you still haven't found out any help, please contact official Viber support here: help.viber.com/contact. Remember, that this subreddit is unofficial, and was created for regular user's discussions. Thank you

*I am a bot, and this action was performed automatically. Please [contact the moderators of this subreddit](/message/compose/?to=/r/viber) if you have any questions or concerns.*",viber
"Hello. If you still haven't found out any help, please contact official Viber support here: help.viber.com/contact. Remember, that this subreddit is unofficial, and was created for regular user's discussions. Thank you

*I am a bot, and this action was performed automatically. Please [contact the moderators of this subreddit](/message/compose/?to=/r/viber) if you have any questions or concerns.*",viber
"Hello. If you still haven't found out any help, please contact official Viber support here: help.viber.com/contact. Remember, that this subreddit is unofficial, and was created for regular user's discussions. Thank you

*I am a bot, and this action was performed automatically. Please [contact the moderators of this subreddit](/message/compose/?to=/r/viber) if you have any questions or concerns.*",viber
"Recently got a new iPhone and I want to sync all messages and groups on the Viber in my old phone (iPhone as well) to my new one. Researched on this for quite a bit but haven't come across with a solution. 


How does one go about doing this?


",viber
"Hello, is there any way to see if a contact of mine is in a community that has over 2000 members? If I go to the members' section in viber, all members are randomly placed, neither in alphabetical order, nor my contacts in the top or something.",viber
"So I've just started using Viber on Android. Trying to transfer conversation to another phone and I read many tutorials on how to do this.

Now, apparently they've removed the ""Email Message History"" option from settings (if someone knows what version they did this in.. much appreciated so I can downgrade) and the only way to back up conversations is via Google Drive.

Now, if I have a phone using a different Google account.. I cannot restore the conversations? How about and save and restore to local storage option? This makes no sense to me.",viber
"I am using Viber for ages, but a few month ago I started struggle with it. Sometimes the message is only **sent** and not **delivered**, but there is no logical reason for this. Sometimes the message is not delivered to the device for hours, or until he/she opens the app directly. I use it mainly with my wife, in this situation 3 android device and desktop Viber are involved. I think all are properly set, so I guess the problem is not on our site.

Do you have any suggestions? Is it this way for everyone?

Location: Hungary",viber
My friends and I started using Viber as an alternative to facebook's messenger and we are very pleased so far of its capabilities but today we tried to have a group video call and discovered that viber does not support that feature. Does anyone know if it will be supported in  the future and if not why?,viber
"Hello. If you still haven't found out any help, please contact official Viber support here: help.viber.com/contact. Remember, that this subreddit is unofficial, and was created for regular user's discussions. Thank you

*I am a bot, and this action was performed automatically. Please [contact the moderators of this subreddit](/message/compose/?to=/r/viber) if you have any questions or concerns.*",viber
"Hey guys. 

I'm using Viber for a long time without any major issues, but not I have a first world problem: the ""is typing"" bubble isn't there when someone is texting me. The message just appear without any signs that the person was typing. 

I have the latest Viber version for my Galaxy S7 Edge. The first time I noticed the problem was before 1.5-2 months.

After contacting the Viber support, I've done everything written in the mail but without success.

Has anybody an idea how to fix that?",viber
"It was one thing not to have dark mode and having to cope with this white abomination. Now that it's out, I can't enable it. Title says it all. I am running android pie on a galaxy s9. I even did a clean install. Ready to leave viber , once and for all.",viber
"My number is the same, every time i install viber it's like i have never been on the platform.
Viber does not keep a record of numbers that have been in their system before?!? Or erases them on a given time span?

This is so frustrating, all the people that have Viber and my number receive notification... ALWAYS.


Me: Reinstalls Viber for the nth time.

Viber: Oh, you must be new here?
             Let's spam everyone then!",viber
"The fact that it allows one to backup their messages history in Google servers. The problem is, it is not encrypted.

Irony is, Viber cannot see our messages, but they will happily let Google see them.

You may as well just disable it, fair option but how can you be sure the other person is not sending all of your texts to Google? Its worse because you think your communications are safe while infact it is not because the other person you are talking to has unencrypted backups to Google enabled.

Well, you are an average joe who uses Viber because of it's superior(I... mean superior to Facebook Messenger) video and audio calls and the fact that your photos are not degraded when it is sent over Viber. But can you see this sorta ""Ooh Viber is the most secure thing in the planet because noone other than the other people you are talking to can see your messages"" being a little bit misleading?

Is this the end? Should we stop trusting Viber? I think we should rather try to ask the people behind Viber to encrypt the message backups created by Viber. It wouldnt be hard thing to implement. And while we are at the backup section, maby ask them to allow us to locally backup our messages in our phone(encrypted) that we can manually move around and backup to cloud service providers of our choice rather than just Google?",viber
"Hello. If you still haven't found out any help, please contact official Viber support here: help.viber.com/contact. Remember, that this subreddit is unofficial, and was created for regular user's discussions. Thank you

*I am a bot, and this action was performed automatically. Please [contact the moderators of this subreddit](/message/compose/?to=/r/viber) if you have any questions or concerns.*",viber
"Hello. If you still haven't found out any help, please contact official Viber support here: help.viber.com/contact. Remember, that this subreddit is unofficial, and was created for regular user's discussions. Thank you

*I am a bot, and this action was performed automatically. Please [contact the moderators of this subreddit](/message/compose/?to=/r/viber) if you have any questions or concerns.*",viber
"I just received a phone call from a private number on viber. While it rang I could see the number, but when I picked up no-one answered, and now the number disappeared. It just says ""unknown"" in calls, and ""private number"" when I click on it. 

How is this possible?
I couldn't find anything online..",viber
"Hey guys I just joined, I wanted to ask smth I am using a 12 pro max currently and every time I call someone and video chat them, firstly the camera quality is rubbish and secondly, which is the bigger problem my rear camera is mirrored...
Does anyone have this issue and is there a way to fix it cuz it?s getting extremely frustrating...??",viber
"My company is researching group chat apps and would love as many insights from real-world users as possible. 


The linked anonymous survey should only take about 10-15 minutes to complete and we'd be forever grateful for your input.


Mods, please remove if I'm breaking any rules!",viber
"I have a Redmi Note 8 Pro, for the past while Viber has been refusing to send video files. They seem to upload, I see the progress bar filling, and then when it's done, it just starts loading again. I have tried clearing my cache (which I do regularly anyway), and it hasn't helped. I haven't managed to find any other solutions online. Any ideas?",viber
"Hello. If you still haven't found out any help, please contact official Viber support here: help.viber.com/contact. Remember, that this subreddit is unofficial, and was created for regular user's discussions. Thank you

*I am a bot, and this action was performed automatically. Please [contact the moderators of this subreddit](/message/compose/?to=/r/viber) if you have any questions or concerns.*",viber
"same here! lost everything. years and years of chats! and then worst thing, the restore did not work. I logged in and there was no option for restore. only for backup. and I am afraid my previous backups got lost too! crappy app! and when I tried to check the app on my PCs and tablet.... logged out too!",viber
"I have been using viber on my laptop for quite some time. And at some day, it was began booting for a very long time and switch from one chat to another for a very long time. Perhaps my decision will help someone. I use viber on linux but I think this should work on windows too.

All we need is sqlite3 utility. Go to the home folder in \~ / .ViberPC and find all files with the extension "".db"". Next you need do:

    echo ""VACUUM; REINDEX;"" | sqlite3 <file.db>

I am using that script:

    #!/bin/bash
    
    SQLITE=`which sqlite3`
    
    echo ""Starting vacuum viber sqlite databases.""
    if [ `basename $SQLITE` = ""sqlite3"" ]; then
        find ~/.ViberPC/ -name ""*.db"" | while read i;
        do
            echo ""Vacuum $i in progress...""
            echo ""VACUUM; REINDEX;"" | $SQLITE $i
        done
        echo ""Vacuum finished.""
    else
        echo ""Please install sqlite3 first.""
    fi
    
    echo ""Clean thumbnails cache...""
    rm -rf ~/.ViberPC/*/Thumbnails
    echo ""Done.""

Now it's working well and faster. ;)",viber
"Hi everyone, I?ve just changed from Android to iPhone 11 and cannot find GIFs anywhere. The icon is missing in the chat bar. I?ve tried a few things suggested by google and reinstalled the app three times with no luck. Any help would be most appreciated! Thanks",viber
"Hello. If you still haven't found out any help, please contact official Viber support here: help.viber.com/contact. Remember, that this subreddit is unofficial, and was created for regular user's discussions. Thank you

*I am a bot, and this action was performed automatically. Please [contact the moderators of this subreddit](/message/compose/?to=/r/viber) if you have any questions or concerns.*",viber
"I resintalled both my phone and my computer multiple times, (I even got a new one from both) but It only kept my stickers on my PC. Is there a way to transfer them, because I can't find most of them in the shop anymore.",viber
"&#x200B;

[Any of you experienced this? On v10 compatibility mode it was working fine. But now v11 also gets transparent. Any suggestions on a fix?](https://preview.redd.it/rzesttr8rda31.png?width=1081&format=png&auto=webp&s=37c034f422b5910ac50e22f72d2d561a9d7cb5ac)",viber
"Has this ever happened to anyone?  Viber sent me a ""congratulations you're a super user"" notification to my Android phone even though I only used a couple of times a few months back. I haven't used it since. Any thoughts?",viber
"I tried hiding chat of a contact on mobile. When I unhid the contact, everything was normal again on mobile, but the contact disappeared from the PC contact list. 

When I searched and added the contact on PC, the old chat thread was lost. It's as if the contact is a new one on PC. New chats with the contact are, however, synced between mobile and PC. 

Any suggestion to bring back the old chat thread on PC?",viber
"Is it libcurl?  


On Ubuntu, I have to manually update the viber.deb to include a reference to the latest libcurl so my machine doesn't try to uninstall libcurl4 to install libcurl3 for Viber. Viber works just fine with libcurl4.",viber
"Hello. If you still haven't found out any help, please contact official Viber support here: help.viber.com/contact. Remember, that this subreddit is unofficial, and was created for regular user's discussions. Thank you

*I am a bot, and this action was performed automatically. Please [contact the moderators of this subreddit](/message/compose/?to=/r/viber) if you have any questions or concerns.*",viber
"can i delete the images and videos on the viber folder? if so can i still view them if i go to open my viber?  

how can i see history of a chat group i newly joined? is this possible?  

is there a way to dl all images and videos off a group chat?",viber
"Viber is one of the worst messengers ever made, switch to a better alternative, like Telegram, to get a faster, more feature rich ad free experience, and move your friends there

*I am a bot, and this action was performed automatically. Please [contact the moderators of this subreddit](/message/compose/?to=/r/viber) if you have any questions or concerns.*",viber
"&#x200B;

I've had Viber for desktop on my previous PC before but I'm a bit skeptical about downloading it I use 70% of my PC for gaming and the rest for productivity, talking to friends etc all the normal things you would do /w your computer. But does it slow my PC down? Please help.",viber
"Basically what the title says.

It's still present on version 8.2.0, if I want to shutdown my PC, I have to manually close Viber, otherwise shutting  down is stuck at ""This App is Preventing Shutdown"" - no icon and no name.

Any idea how to fix this? I can replicate this on at least two different computers.

Thanks.",viber
"Hello, i've been having a lot of issues with Viber - nothing else on my computer has these issues.

The only way I can get viber to sometimes work is if I open it using the compatibility mode. 

My issues:

* If a gif or image is sent, Viber will crash
* if a message is sent while I don't have Viber open, it will crash
* If i'm in a call, viber will crash

Things i've tried

* Reinstalling Viber
* Reinstalling Windows
* Installing an older version of Viber

Pc specs

* Ryzen 5800x
* RTX 2080 Super
* 16GB Ram

When viber does it's crash, it will sit there hogging 10% CPU usage as well.",viber
"Hello. If you still haven't found out any help, please contact official Viber support here: help.viber.com/contact. Remember, that this subreddit is unofficial, and was created for regular user's discussions. Thank you

*I am a bot, and this action was performed automatically. Please [contact the moderators of this subreddit](/message/compose/?to=/r/viber) if you have any questions or concerns.*",viber
"I mean, some of this is just user error right?

You can fix 2 by muting Viber on your computer (your volume control will let you control apps independently). That way it if your away from your computer the sound won't disturb anyone.

3 is just a feature you don't want. Don't use it.

4 is super common. Many apps minimize when you hit X but continue to run. You'll see a Viber icon in the system tray and can close it fully there.",viber
"I have tried multiple utilities and web search, but can't seem to find any way of export the message history from the latest Viber app on Android, nor can i export from Viber application on Windows.  Does anyone know of a good method of exporting message history?  Thanks.",viber
Hey everyone so not sure if this has been asked here already but it's pretty much what the title says I'm using a samsung S7 edge and ever since I installed viber from time to time the qr code keeps popping up randomly without me opening viber or its qr code scan feature. Was wondering if anybody else had this problem and a solution to it?,viber
"In any group chat, press and hold on your own message and a menu will appear. 'Info' is an option in that menu which is what you're looking for.

In a one-to-one chat, you cannot like messages but a small indicator in the lower corner of you messages indicates when your message is send (1 tick), received (2 ticks), and read (2 purple ticks).",viber
"Hi all. I've been freeing up space on my phone by uploading all of the photos of my pets into an album on my personal Facebook page. Finally, after everything being SUPER out of order, I've started to edit the date on the photos. I understand that this will reorder the posts within my timeline, but I want everything to show in chronological order within the album as well. As by this point I have 5.5 years of pet photos to go through (and well over 1,000 photos already uploaded), using the ""drag and drop"" option to reorder things is COMPLETELY out of the question, as that would take weeks. I know I've got some doubles (and even triples, because sometimes I took screenshots of the photos), and I'd like everything to be in chronological order so I can easily delete these duplicates.

So far the only way I can find to edit the album is to drag and drop. Any one remember being able to chronologically order their photos (we were able to do it, I don't know, like 3-4 FB updates ago?), or how to bypass and make this happen without the drag and drop?

Big thanks for any help! (The photos attached are the only options I have when trying to edit an album)

\*\*Edited to add\*\* switching over to feed view only changes the look of the layout from grid to posts for \*me\*, and doesn't do anything about the date of the photos, only when I uploaded them as a batch (I upload anywhere from 2-40 at a time)

https://preview.redd.it/njzhn35j9io71.png?width=1485&format=png&auto=webp&s=d84cb068d12812e110afb0edf4e2fcfc67a9fd1b

https://preview.redd.it/tytxb85j9io71.png?width=1872&format=png&auto=webp&s=d157ef9f505fd1d1e7944fe886b8782696748c55",Facebook
