body,subreddit
"...im curious why you would apply for a customer service role at a platform you don't like or use...? Being invested in the platform and knowing how to use it is a 'thing' at places like FB, Twitter and LI. Hope it works out for you, but as a recruiter I would definitely see it as a potential red flag if you don't actually use the platform, some customer management systems depend on you linking you profile to the CRM.",Linkedin
"I know that this isn't an official LinkedIn forum nor a place for users to send in feature requests. But thought I would post this here on the chance that anybody knows a way to achieve what I'm trying to do.

Currently keeping an eye on LI for remote jobs. 

The ""worldwide"" filter is my friend in this respect. As is the remote filter. However, it would be even more useful if my search filters could be remote - (minus) countries: A,B.

Country A: lots of jobs showing up but as it's a developing world country there's virtually no chance that any of them are going to be worth considering.

Country B: not interested in working with companies from this territory but there are a lot of them recruiting and the LI algorithm (or them sponsoring posts) is making them clutter the results pages.

Any workarounds?",Linkedin
"You have good instincts. Most good recruiters understand it's as much as about building their network for the role you may be a great fit for in X years as much as the role they're trying to find this week. Be human, don't worry about being lame. Being able to connect to people, especially digitally, takes practice, worry less about getting it right.

Hi \[their first name\]

Like you, I also attended \[ABC Virtual Conference\]. I'm not looking for roles right now as a rising senior at \[XYZ College/University\] studying \[Major\]. I hope we can connect to be of value to each other in the future.  What session at ABC did you learn the most?

\- \[your first name\]

Friendly, sets expectations, takes an interest in their needs/wants.",Linkedin
"Hi all! I?m unable to view all job listings in my area. It only shows sales job listings. I work in sales; however, I?m trying to branch out into a different career. Any ideas on how to get LinkedIn to show me everything?",Linkedin
Number of connections does not matter but if you are interviewing with LinkedIn it would be in your best interest to have a LinkedIn page.   They will look for it and not having one could leave the preciption that you are not interested in their product.,Linkedin
"[https://preview.redd.it/blzmkh2odij71.jpg?width=640&crop=smart&auto=webp&s=4ac174fdc9379ac9a880b611f6f26fcf6c3a98a1](https://preview.redd.it/blzmkh2odij71.jpg?width=640&crop=smart&auto=webp&s=4ac174fdc9379ac9a880b611f6f26fcf6c3a98a1)

&#x200B;

[https://preview.redd.it/d1adsswndij71.jpg?width=640&crop=smart&auto=webp&s=3bd986038c5e0bab85cbe128da4f6bb249c93821](https://preview.redd.it/d1adsswndij71.jpg?width=640&crop=smart&auto=webp&s=3bd986038c5e0bab85cbe128da4f6bb249c93821)",Linkedin
I got multiple suspensions on my account with a warning that I may get permanently banned. Like you I just browse the site and don't do anything malicious or use bots to automate activity. Their customer support emails don't explain why it happened. They only tell me to be careful or I might get banned. I have no idea what is going on with Linkedin though it might be some new campaign to sweep a lot of suspected bad account activity across all users.,Linkedin
"Doesn't make a difference to me what my professional contacts do in their spare time.  

Since you've mentioned Facebook - I use LinkedIn the same way I use Facebook: I ignore the news feed. Sure, it's there when I open the app, but I hardly ever scroll down. Without the feed, I find LI more efficient to use.

I still interact with my network, but by actively searching for content I find worthy of being interacted with (instead of being forcefed by the LI feed). For example, I search for posts that contain certain keywords, sorted by newest first. Keywords could be a conference I've just attended and I want to interact with other attendees. Or a term I happen to be knowledgeable about. Or simply words like ""happy"" and ""proud"", filtered to 1st degree connections, so can keep tabs on my contacts' most recent achievements and congratulate them.",Linkedin
"Yes, unironically: yes.The point of a network on LinkedIn is that recruiters will go through the 'shared' connections of people to find more candidates.

&#x200B;

Some of your friends will end up in similar fields, those connections will pay off one day.

&#x200B;

Even in this digital word, who you know sadly does matter.",Linkedin
"Ive worked for a client on other social feeds and now they want a LinkedIn. How do I grow their company page. The research I've done basically doesn't say much other then the basics such as share, post at the best time, make good content, etc...

Is there anything else that can be done?",Linkedin
"For me it's two things.  Firstly, I find email marketing has a significantly stronger ROI for my business.

Secondly, my business hasn't reached the stage where I can run a properly integrated campaign.  So to use Linkedin plus the other stuff, I need a ton more money for that.

I used Linkedin for organic reach.  This kind of stuff:  https://www.linkedin.com/posts/paulwalkerlondon\_marketing-leadgen-leadnurturing-activity-6786232129576550400-9WwC",Linkedin
"I have the opposite problem, I work in the Bay area and I desperately want to get out. I get one or two recruiter messages a day but they all are hiring for positions in SF or San Jose. Not sure if there's a way to set a preference to be recruited to a specific city that you don't currently live in...",Linkedin
"Occasionally, as I'm sure we all do, I will get a message from (Someone) @ LinkedIn Learning is offering me a free month of the program. 

I'd be lying if I said I hadn't considered it before but how valuable is it? Do companies actually view that as legit training and skill development?

I am looking to deepen my skill set and make myself a more viable candidate and was wondering if this is a legitimate program to consider.",Linkedin
"I embarked on a masters study and would like to show that on my network, however after entering all details under ?New education? and testing through one of my friend?s account, it?s not seen on newsfeed?",Linkedin
"after 19K followers starting a few days ago, I realize this weird, I did not see any messages. I've been using LinkedIn a lot because of depression and anxiety and no social contact. I've been volunteering to share about Public Health, current news, and educations. https://www.linkedin.com/in/DaoIsTheWay does anyone know how to resolve this kind of issue. Thank you for reading, I hope you all enjoy your day. Dao",Linkedin
"Customer services included the reason as ""We noticed that an unusually high volume of pages was being viewed through your account despite our previous warnings --- is it still possible to appeal and take back my account? Simply can't afford to lose numbers of connections and start over from nothing.",Linkedin
"I've use LinkedIn for work pretty much every day for a few years now and have never run into this problem until yesterday. Suddenly it's loading prohibitively slow. So much so I can barely even use the platform.

Is anyone else experiencing this recently? I'm trying to figure out if it's site wide, or something to do with my browser. I've tried logging out and back in again, clearing my catches, etc, but I'm still just stuck in perpetually loading mode any time I try to interact with a comment or read a post.",Linkedin
"I completed a online course on Coursera and there are 4 photos of the final project I made. I would like to share them in specific order so that certificate is first and the idea of project flows with 4 successive photos. But there seems to be no drag and drop nor does naming or size hierarchy work. I don't think last saved ones first is working for me either. But each time I select them they appear in that specific order. So it's not even random. 

How can I make this work?",Linkedin
"Hello,

&#x200B;

I received a request from a company called VisasQ last week to consult for them for pay the following week. I did some research online to check them out and asked around in a few circles to confirm it was all legitimate in so far as possible. 

They are mentioned in plenty of news articles and their website as well as their communications have been reassuringly professional. I can't find much online from other people who have done this kind of work for them though. I also can't find anything linking them to a scam of any sort either.

&#x200B;

So I'm reaching out here to see if anyone has had any engagements with them. All I've found is a year old reddit thread but the commenters didn't reply to my messages.",Linkedin
"You won't get a notification if they reject it, only if they accept it.  You can see outstanding sent invitations if you go to 'My Network', then click on 'Manage' (which is to the right of 'No pending invitations' near the top of the screen. If you click on Manage, you'll see received/sent invitations outstanding. Unfortunately, if you've already sent an invitation to them and they've rejected it, you have no way of knowing. If you send it again, you'll be able to keep an eye on if they rejected it if it disappeared from the 'sent' tab.",Linkedin
"I love LinkedIn, I like being able to keep a record of my work and update my digital CV on the fly for potential connections to see. However every time I?m on there I seem to be seeing a disproportionate amount of posts that aren?t business related, but are about someone?s sick child or a family member who has passed away or beaten illness. It?s so often and it?s really not what I imagined a business platform to be all about. Curious if anyone else is getting these or perhaps I have some strange algorithm!",Linkedin
"Let's say I worked for Company X in one position from 2005-2010, and then I worked there again in a different position from 2012-2015.  The way it's set up on my profile now, Company X is listed twice (once for each position).  However, if the two positions had overlapped into each other without a gap in between, then there would only be one entry for Company X and two positions would each be listed below it.  Is there a way to combine two non-consecutive positions at the same organization under one heading, or will they always be separate?",Linkedin
"Have you tried the creator-mode? How often do you post? If you want to do business on LinkedIn, I would recommend you to join r/sales or similar and ask for help there. I have boosted my business by using LinkedIn and I see no reason why you can't.",Linkedin
"Some people are proud of working for the company they do. If the company does a nice image it is probably going to be better than a stock image people would find or what people can make. As far as promoting themselves, most people aren't good at it, or don't think about it that way. Even freelancers,  speakers etc. Often have tacky images that in my view do more harm than good. The most common image I see is of the city they live in, which usually looks nice, but also doesn't do anything for marketing themselves.",Linkedin
"Looks like. Also it?s not clear how they are rolling it out, I mean the criteria. My wife?s got it but I don?t have it yet. We are running the same version of iOS and LinkedIn app. I don?t even see the ?Display? option under settings.",Linkedin
"My LinkedIn connections fall into one of two categories:
1. Personal connections who I actually know
2. People who I actively want to connect with 
 
If someone falls into #2, it means I will most definitely be trying to reach out to them via inmail and have a conversation - maybe try to meet up for a quick coffee or something.

This means if someone I don't know sends me a connect request and I don't foresee a coffee chat, I don't accept them.

Be aware that there are lots of really creepy people on LinkedIn. If you're a woman, creepy creeeepy men will try to connect with you. If you're a man, beautiful women will try to connect with you trying to sell you stuff. 

No shame in turning down a request! Do what you're comfortable with.",Linkedin
"Yes, this happens all the time and is a great use of the platform. It works best when the person is specific about the types of opportunities they are looking for and where they are located. It?s helpful if they?re already active on LI because they?ll reach more people.",Linkedin
"were using a bot? because apparently Linkedin takes severe decisions on accounts using those chrome extensions that send random connection requests.   


Try contacting them directly, and tell them that your account was being used by a third-party app that sends connections randomly without your approval.  


However for those reading this, please keep in mind that the new limit of connection request set by LinkedIn is 100 connections per week, if you want to play a game know the rules.",Linkedin
"Has this happened to anyone? I work for a branch of a consulting firm in CEE. We've been talking with LinkedIn staff about buying a corporate license for four months now. The talks were very slow since the beginning but in the last month and a half, we've got completely ghosted by everyone from Linkedin (our assigned account manager, people from tech support,...). 

Has anything like that happened to you? If so, what was the problem and how did you solve it?",Linkedin
"I'm honestly not sure, I know that if you go to network you can sort by two or more connections. Then you can look at the list of who is recommended. You can narrow it with another search term. Good luck!",Linkedin
"You can go onto settings and choose to let people know about changes/updates to your profile. However, I?d suggest turning it off after you change the job title - because these notifications can go out every time you update your profile, which can get annoying for connections (and also you may not want to broadcast each change you make). But yeah, in a nutshell, there?s a way to let people know by allowing LinkedIn to send profile updates through the ?Visibility? tab under settings - you?ll have to scroll to the end where a header will say ?Notify people of?? (don?t remember it verbatim) but you?ll know what I mean when you open it! Hope this helps :)",Linkedin
"It feels that way sometimes. When I first signed up years ago it was for adding your coworkers, having an online resume, and looking for/posting job openings. Now I constantly see LinkedIn influencers post 'motivational' stories, make idealistic posts about how recruiting should be done, or random political posts that aren't relevant to careers. There's also the 'I want to thank *company* for giving me the chance to work for them/do this internship' posts that feel so cringy to me. For crying out loud just put the job in your profile, no need to tell everyone about it.",Linkedin
"I recently received a few connection requests which I believe are from fake accounts. They have shiny profiles but 0 or very few connections.  After failed to engage me in offline chats, their profiles all disappeared. I reported them to linkedin. They might very well be from the same fake person.  

I now received another request, again shiny profile, but what's weird is this person's profile does not show number of connections information at all.  I know linkedin can hide your actually connections but will always display the total number of connections/followers, even if it is 0.  Does anyone know what is going on? Does linkedin provide an option not to show 0 connections, or not to disclose total number of connections?",Linkedin
"I have this same question:

>Why can't I remove the company of my most previous position from the header area?  
>  
>??  
>  
>When I click to edit, it shows an checkbox asking if I want to show my education, but I don't see the same for most previous position.  
>  
>I am unemployed currently, but I am also a student so I don't want the name of a company that I don't work for anymore next to my name.

\---this is from an archived thread.  I was going to link to it, but then got the welcome bot with the rules about links---

I spent a long time googling the question in the above archived post from a year ago.  i finally thought i found the answer when i found that post.  In the thread it says that the person figured it out and the thing they wanted to remove wasn't actually there publicly. so, I viewed my profile in an incognito window (so, not signed in) and it's still there.what am I doing wrong.

this is really dumb, why is this \[seemingly\] automatically set without any way of turning it off?   it was really easy to remove ""education"" from this same spot.

thanks.",Linkedin
"You would have to remove and redo it.  Like the other guy said there's an option to show updates to your profile and it affects every change you make on it.  I leave it off because I've been making a ton of changes to my profile and don't need to spam people updating old jobs and skills and interests etc.

If I got a new fancy job and wanted people to know I would turn it on , update my profile, then turn it off until next promotion.",Linkedin
"Developed to suit business needs, LinkedIn found a way to measure how effective you are at building your brand, finding the right people, engaging with insights, and establishing relationships.ÿThis is your Social Selling Index (SSI).ÿ  


Users with higher SSI are better positioned to make new leads, and therefore more likely to succeed in closing the deal. This is LinkedIn?s way of awarding those with high social selling skills.ÿ  


Learn [4 ways to improve your LinkedIn Social Selling Index.](https://skylead.io/blog/4-ways-to-improve-your-linkedin-social-selling-index/?utm_source=Blog&utm_medium=Reddit&utm_campaign=social_share&utm_term=Linkedin&utm_content=)",Linkedin
"You might find that this setting has now changed. As of today when I looked at the settings for a client (I'm a Career Coach), I noticed that LinkedIn has now added an additional location section for remote work opportunities. 

It's not showing in mine (I'm in Europe), but it's showing in my client's profile (US). It's under the 'Open to Work' section, and if you've clicked 'I'm open to remote locations', it enables you to add an additional 5 locations specifically for remote work.

  
So, check out your profile and see if you can see this new field.",Linkedin
"My recommended jobs section says ""Oops! Looks like we're experiencing a problem"". It's been like this for the past week and I haven't been able to fix it by logging out, clearing cookies etc. Does anyone else have this problem?",Linkedin
"Hello everyone,

Is there a setting that does not let a specific person see my posts on LinkedIn? I do not want to block that person. I just don't want them to see my posts. If you could help me navigate this problem or send a link that helps then I would be grateful.

Thank you for your time.",Linkedin
"Either the job posting on Linkedin takes you to the company site to apply or if I applied there directly on my own (or through something like Glassdoor). I keep looking for an option to say ""Applied"" so it stops telling me to remember to do it.",Linkedin
"Absolutely respond. They may be of great use to you down the road. 

Thank them for reaching, out and tell them you're not interested at the time. Doesn't take more than 30 seconds, and they may be an invaluable resource someday.",Linkedin
"A few ideas:

Get employees involved 

Spend time engaging as your page. 

Reach out to your current customers via email and other platforms inviting them to follow your LI page.

Low results, but add a link in your email signature.

Run a contest: follow page for a chance to win.",Linkedin
"I want to block someone but don?t want them to see I went on their profile, I?m on private mode now but obviously don?t want to stay in private mode as I want to actively network. Will the person see I went on their profile after I block them?",Linkedin
I keep seeing job posts from a company with extremely vague job/company descriptions that I'm pretty sure is just some MLM. I don't necessarily want to report them for abuse; I just want to stop seeing their spam on my job feed. I wish Linkedin would just let us block individual companies already.,Linkedin
"Why does a LinkedIn message disappear from my inbox in messaging?

Some threads just disappear. I din?t archive them. I can open thread using link from notification email and I can see all messages, but I don?t see the thread in the inbox.",Linkedin
"I have also experienced this. In your  ""experience  section"" & '""skill section"", remove all keywords that are associated with that job and replace it with  the keywords you like to ranked for. Once you do this, you will stop appearing in the search result for those keywords that you don't like.",Linkedin
"Hello,

I just had to set up a linkedin acct for school and am required to get a certain number of connects/follows and I was looking under the pages of past jobs and whenever I click on the employees tab it wont let me see the peoples names, just says linkedin member and when I click on their profile this message pops up.

Is there any way to work around this? Any setting issues on my end?",Linkedin
"the last year and a half has undoubtedly sparked drastic changes in all of our day-to-day operations. i have been working as an essential worker at a retail store since the start of the pandemic even though i received my bachelor's degree a little over a year ago. the pandemic coupled with personal struggles (e.g., sexual trauma, life changes coupled with a fear of change, relationship problems, self image, etc.) has rendered me feeling inept, lazy, afraid, and incapable of moving forward and starting my career. i guess i got too comfortable at my current retail position?as much as i *loathe* my job?and have failed to consistently apply and seek out new opportunities. as a result, i haven't made a single post on linkedin since september 2020. i feel like i'm at a complete loss with what to do with myself.

that being said, i feel more inclined and more motivated to find a beginner position within my field. i was hit with a realization that i need to do something about my current situation because i *do* want something better. i *do* want a more fulfilling job doing something in my chosen field.  i'm a tech comm major who feels so small and lousy at this line of work. i'll admit (according to what professors have told me) that i excel at conducting research, writing reports, and conveying information concisely. other than that, i feel like i'll never be able to understand how to do basic graphic design (i ultimately want to do something in UX/UI), code or even learn XML. i feel like i'll never get a handle on this job hunting game and have neglected my linkedin profile while i mindlessly applied through various job search sites.

i'm asking for your help. someone's help. anyone's help. if you can understand where i'm coming from and have been in the same or a similar position, i am *begging* you: tell me how to get back in the game. i know there's a plethora of information out there on youtube, linkedin learning, hubspot, you name it. i feel like i've been on hiatus from linkedin for far too long that i don't even know how to approach creating a ""comeback"" post, so to speak. please, give me your honest advice and nudge me in the right direction? i need help now more than ever...

&#x200B;

! edited for grammar !",Linkedin
"I'm 61, I found the best solution was to remove keywords from my profile to stop the crazy matches.

I'm only 9 months into my current role and I'm getting recruiters messaging me on LinkedIn asking if I'm interested in moving on...

Also, I've been capable of doing a tools role at a games company for a long time and only *NOW* since I started as a tools programmer they're messaging me?!?",Linkedin
"Hello, I am a developer looking for a way to get an applicant's resume into my web page. I have found this: [https://docs.microsoft.com/en-us/linkedin/talent/easy-apply#retrieve-applicant-resume](https://docs.microsoft.com/en-us/linkedin/talent/easy-apply#retrieve-applicant-resume)  
But it is not accessible to the public. Is there a way around it? anyone ever worked on something similar? I need some ideas to make this work, so if you have any suggestions I will appreciate it if you comment em down below. Thanks in advance",Linkedin
"Hello, I've picked up some work for a company as a contractor. They've added me as an admin on their page so that I can run ads. However, since I don't work for the company, I don't have the credit card to use on my own ad account. Is there a way for the owner of the company to add a credit card for billing another way or do they have to give me the number to put into my own account if I want to run their ad? Thanks in advance.",Linkedin
